<!ELEMENT foret (#PCDATA|arbre)*>
<!ELEMENT arbre (tronc)>
<!ELEMENT tronc (branche*)>
<!ELEMENT branche (branche|feuille)*>
<!ELEMENT feuille EMPTY>
