<?xml version="1.0" encoding="UTF-8"?>
<!DOCTYPE foret SYSTEM "arbres.dtd">
<foret>
  <arbre>
    <tronc>
      <branche>
        <feuille/>
      </branche>
    </tronc>
  </arbre>
  <arbre>
    <tronc/>
  </arbre>
  <arbre>
    <tronc>
      <branche>
        <feuille/>
      </branche>
    </tronc>
  </arbre>
</foret>
